{
  "schemaVersion": "1.0.0",
  "tenantId": "018f47c2-4a3b-7a10-8a11-000000000001",
  "projectId": "018f47c2-4a3b-7a10-8a11-000000000002",
  "executionPlanId": "018f47c2-4a3b-7a10-8a11-000000000007",
  "planRevision": 1,
  "planRequestDigest": "84f464123497aabc85c3b273eed339f5e092a69941ef6da5a895ce54d41cc41c",
  "planDigest": "ba90481906b36a9379513456cfd23627c7d84d13a6e4990c6d09502cdf529dbc",
  "planManifestObject": {
    "schemaVersion": "2.0.0",
    "objectRefId": "018f47c2-4a3b-7a10-8a11-000000000011",
    "tenantId": "018f47c2-4a3b-7a10-8a11-000000000001",
    "projectId": "018f47c2-4a3b-7a10-8a11-000000000002",
    "dataPlaneBindingId": "018f47c2-4a3b-7a10-8a11-000000000003",
    "dataPlaneId": "018f47c2-4a3b-7a10-8a11-000000000004",
    "provider": "AWS_S3",
    "uri": "s3://video-world-fixtures/execution/plans/plan-manifest.json",
    "objectKey": "execution/plans/plan-manifest.json",
    "format": "JSON",
    "mediaType": "application/vnd.video-world.execution-plan-manifest.v1+json",
    "checksum": "6fa9d6032d9beb19f55f18f95c9d28e2e2abc51ef3256c871c773cd8d25b9e56",
    "sizeBytes": 1517,
    "etag": "plan-manifest-etag",
    "versionToken": "plan-manifest-version-1",
    "schemaDigest": "c501d3c11c1ff7f25b58c414a507e779ec91f8b5608a7ddb50e63d1514a09e11",
    "encryptionContextDigest": "36ec5661379829161af913ac91de2871d391097c92ab21f1ba2c7bfffb5ec774",
    "createdAt": "2026-10-22T00:00:06Z",
    "identityDigest": "ed84a39300893b00275a67d93b0b4ef6c5400f99f09e9533e975737fe54818ef"
  },
  "planManifestSemanticDigest": "305241b55eec5852385baedd37ff09298506e5397c1389442eb4b9982677e975",
  "receiptSetObject": {
    "schemaVersion": "2.0.0",
    "objectRefId": "018f47c2-4a3b-7a10-8a11-000000000012",
    "tenantId": "018f47c2-4a3b-7a10-8a11-000000000001",
    "projectId": "018f47c2-4a3b-7a10-8a11-000000000002",
    "dataPlaneBindingId": "018f47c2-4a3b-7a10-8a11-000000000003",
    "dataPlaneId": "018f47c2-4a3b-7a10-8a11-000000000004",
    "provider": "ALIBABA_OSS",
    "uri": "oss://video-world-fixtures/execution/receipts/receipt-set.json",
    "objectKey": "execution/receipts/receipt-set.json",
    "format": "JSON",
    "mediaType": "application/vnd.video-world.receipt-set.v1+json",
    "checksum": "91dca780322bd60475021526a38f3a5662a76cfc39bb04f9b7bbbacd7226fa09",
    "sizeBytes": 1673,
    "etag": "receipt-set-etag",
    "versionToken": "receipt-set-version-1",
    "schemaDigest": "464ac4cc1bf1705a0631960ef745dccbbf870e6b9f9390c122a0fee8d55a94ff",
    "encryptionContextDigest": "36ec5661379829161af913ac91de2871d391097c92ab21f1ba2c7bfffb5ec774",
    "createdAt": "2026-10-22T00:00:06Z",
    "identityDigest": "cdebf6ab47a0b0e6e6a7c36761cac4dbaf79e4a7553470f55494f1054c750d28"
  },
  "receiptSetSemanticDigest": "8df79f88dfa78edb10c655f0db505d11278f411503a47e0f9c59c77d4db810da",
  "resultKind": "WORLD_STAGED",
  "resultDigest": "214b9fdfda12ecbbc3aa9e6905ce0b46660c03c8f40eb87b21f393b2aa6b34b7",
  "resultObjects": [
    {
      "schemaVersion": "2.0.0",
      "objectRefId": "018f47c2-4a3b-7a10-8a11-00000000000b",
      "tenantId": "018f47c2-4a3b-7a10-8a11-000000000001",
      "projectId": "018f47c2-4a3b-7a10-8a11-000000000002",
      "dataPlaneBindingId": "018f47c2-4a3b-7a10-8a11-000000000003",
      "dataPlaneId": "018f47c2-4a3b-7a10-8a11-000000000004",
      "provider": "ALIBABA_OSS",
      "uri": "oss://video-world-fixtures/execution/results/part-00000.json",
      "objectKey": "execution/results/part-00000.json",
      "format": "JSON",
      "mediaType": "application/json",
      "checksum": "5c35586ddece9522ed38515beed976b376a838a8025a8cebbe91b4ec30480f69",
      "sizeBytes": 256,
      "etag": "result-etag",
      "versionToken": "result-version-1",
      "schemaDigest": "0db08be56afb935c4ead04578ad95e62bc66ba6a155cfd6249836fb22d7ef5ea",
      "encryptionContextDigest": "36ec5661379829161af913ac91de2871d391097c92ab21f1ba2c7bfffb5ec774",
      "createdAt": "2026-10-22T00:00:02Z",
      "identityDigest": "835fe84cbe0f1fd85a8049923d2b30bedbd052336f624a7283561212b00b676e"
    }
  ],
  "createdAt": "2026-10-22T00:00:07Z",
  "semanticDigest": "b64407ddfbd52590422ce59899be93aaa2ce974e39e412ce107376ab8fea822e"
}
